{
  "version": 1,
  "benchmark_id": "etcdraft-public-calibration-v1",
  "benchmark_digest": "88afdb71f1c339c01b6fe2a468ebacc63568c97950d61b7b5cca5ee3c8795303",
  "trials": [
    {
      "trial_id": "trial-41c7a1",
      "campaign_report": "../campaign/trial-41c7a1.json"
    },
    {
      "trial_id": "trial-a93d5e",
      "campaign_report": "../campaign/trial-a93d5e.json"
    }
  ]
}
